{
  "predecessorProgramLineageEnvelopeDigest": "sha256:1111111111111111111111111111111111111111111111111111111111111111",
  "programIdentityDigest": "sha256:2222222222222222222222222222222222222222222222222222222222222222",
  "connectivityPlanDigest": "sha256:3333333333333333333333333333333333333333333333333333333333333333",
  "postgresqlMigrationPlanDigest": "sha256:4444444444444444444444444444444444444444444444444444444444444444",
  "containerImageCicdPlanDigest": "sha256:5555555555555555555555555555555555555555555555555555555555555555",
  "readinessEvidenceDigest": "sha256:6666666666666666666666666666666666666666666666666666666666666666",
  "iacPlanDigest": "sha256:7777777777777777777777777777777777777777777777777777777777777777",
  "deploymentManifestDigest": "sha256:8888888888888888888888888888888888888888888888888888888888888888",
  "deploymentApprovalDigest": "sha256:9999999999999999999999999999999999999999999999999999999999999999",
  "environment": "prod",
  "environmentReference": "environment.production.orders",
  "targetReference": "target.postgresql.orders.flexible"
}
